{
  "$schema": "./config.schema.json",
  "branding": {
    "clientName": "StockerTV",
    "logoUrl": null,
    "primaryColor": "#FF7A59",
    "accentColor": "#34D399",
    "accentDeep": "#FF6040",
    "accent2": "#FFA68C",
    "pageTitle": "StockerTV — NVIDIA Demo"
  },
  "hero": {
    "eyebrow": "Article → Script in under a minute",
    "titleHtml": "See how <span class=\"brand-logo brand-wordmark\"><span class=\"brand-logo-stocker\">Stocker</span><span class=\"brand-logo-tv\">TV</span></span> turns SEC filings<br/>into broadcast-ready video, automatically.",
    "ctaLabel": "Watch Demo",
    "ctaSub": "Curated NVIDIA story · 47 sec",
    "stats": [
      {
        "value": "32,000+",
        "label": "companies"
      },
      {
        "value": "53",
        "label": "exchanges"
      },
      {
        "value": "30",
        "label": "agents"
      },
      {
        "value": "24",
        "label": "integrity rules"
      }
    ]
  },
  "chart": {
    "yAxisLabels": [
      "$40B",
      "$30B",
      "$20B",
      "$10B",
      "$0"
    ]
  },
  "audit": {
    "docTitle": "Audit Trail",
    "docSubtitle": "NVIDIA · Q4 FY2025 Financial Update",
    "docId": "DOC-NVDA-2026-0415"
  },
  "multilang": {
    "combinedCapHeadline": "$27T combined market cap reached",
    "languages": [
      {
        "id": "en",
        "countryCode": "US",
        "heading": "English",
        "marketCaption": "NYSE · $24T market cap"
      },
      {
        "id": "pt",
        "countryCode": "BR",
        "heading": "Português",
        "marketCaption": "B3 · $1.2T market cap"
      },
      {
        "id": "es",
        "countryCode": "ES",
        "heading": "Español",
        "marketCaption": "BME · $1.6T market cap"
      }
    ]
  },
  "final": {
    "ctaLabel": "Generate Avatar Video →",
    "runtimeNote": "Demo runtime: 47 seconds · Demo replay slowed for visibility"
  },
  "thumbnail_brand_mark": "NVIDIA",
  "avatar_video_url": "https://yusmntynkiwadtsaagbr.supabase.co/storage/v1/object/public/Tradetok%20videos/NVIDIA%20Q4%20Record%20Financial%20Update_1080p_caption.mp4",
  "showcase": {
    "meta": {
      "company": "NVIDIA",
      "ticker": "NVDA",
      "exchange": "NASDAQ",
      "articleSource": "Reuters",
      "totalDurationMs": 90000,
      "sourceFiling": "10-K, FY2025, filed 2025-02-26"
    },
    "stages": [
      {
        "stage": 1,
        "name": "article_input",
        "delayMs": 400,
        "data": {
          "title": "NVIDIA posts $39.3 billion fourth quarter as data-center sales climb 93%",
          "source": "Reuters",
          "publishedAt": "47 min ago",
          "wordCount": 355,
          "fullText": "SANTA CLARA, Calif. — NVIDIA Corp. reported fourth-quarter revenue of $39.3 billion on Wednesday, exceeding Wall Street estimates as accelerating data-center demand from hyperscale cloud customers continued to drive the chipmaker's growth.\n\nThe quarterly figure represented a 78% increase from the year-ago period and capped a fiscal year in which the Santa Clara company more than doubled its top line. Full-year revenue reached $130.5 billion, up 114%, with data-center sales accounting for $115.2 billion of that total.\n\nData-center revenue in the fourth quarter alone climbed 93% to $35.6 billion, a quarterly record. The segment, which includes NVIDIA's Hopper-generation H100 and H200 accelerators and the newer Blackwell architecture, now represents roughly 91% of the company's revenue mix, underscoring how completely the AI-infrastructure buildout has reshaped its business.\n\nGAAP gross margin came in at 73.0%, broadly in line with the prior quarter. GAAP earnings per diluted share were $0.89, compared with $0.49 a year earlier. Operating income reached $24.0 billion under GAAP measures.\n\n\"Demand for Blackwell is amazing as reasoning AI adds another scaling law,\" Chief Executive Jensen Huang said in a statement. \"We've successfully ramped up the massive-scale production of Blackwell AI supercomputers, achieving billions of dollars in sales in its first quarter.\"\n\nThe company's gaming segment, once its largest, posted revenue of $2.5 billion, down 11% from a year earlier as discrete-GPU demand softened. Professional visualization revenue rose 10% to $511 million, while automotive sales nearly doubled to $570 million as advanced driver-assistance and autonomous-vehicle programs ramped.\n\nNVIDIA continued to rely on Taiwan Semiconductor Manufacturing Co. for the foundry production of its leading-edge GPUs, and on SK Hynix and Micron for the high-bandwidth memory used in its data-center products. Competing GPU vendor Advanced Micro Devices reported its own data-center segment grew 69% in its most recent quarter, while Intel's data-center business posted modest growth amid sustained share losses.\n\nHyperscale customers including Microsoft, Meta Platforms, Amazon Web Services, Google Cloud and Oracle remain the largest buyers of NVIDIA's H100, H200 and Blackwell-generation systems, with several disclosing multi-billion-dollar annual capital-expenditure plans tied substantially to AI infrastructure.\n\nNVIDIA shares were little changed in after-hours trading after the release."
        }
      },
      {
        "stage": 2,
        "name": "watcher_detection",
        "delayMs": 3500,
        "data": {
          "source": "Reuters",
          "publishedAt": "47 min ago",
          "ticker": "NVDA",
          "exchange": "NASDAQ",
          "noveltyScore": 94,
          "noveltyReason": "New story — not covered in the last 7 days (94% unique)"
        }
      },
      {
        "stage": 3,
        "name": "company_enrichment",
        "delayMs": 7000,
        "data": {
          "name": "NVIDIA Corporation",
          "ticker": "NVDA",
          "sector": "Technology",
          "industry": "Semiconductors",
          "ceo": "Jensen Huang",
          "headquarters": "Santa Clara, California",
          "foundedYear": "1993",
          "marketCap": "$3.0T",
          "lastPrice": "$124.65",
          "week52High": "$153.13",
          "week52Low": "$75.61",
          "keyProducts": "H100, H200, Blackwell B100/B200, GeForce RTX 50-series, DGX systems, CUDA platform",
          "competitors": "AMD, Intel, Broadcom, Marvell",
          "description": "Designs accelerated computing platforms, GPUs and networking systems for AI training and inference, scientific computing, professional visualization, gaming and automotive.",
          "dbSize": "32,000+",
          "dbExchanges": "53"
        }
      },
      {
        "stage": 4,
        "name": "fact_extraction",
        "delayMs": 11000,
        "data": {
          "facts": [
            {
              "text": "Q4 revenue: $39.3 billion (up 78% YoY)",
              "sourceSpan": [
                70,
                83
              ]
            },
            {
              "text": "Q4 data-center revenue: $35.6 billion (up 93% YoY)",
              "sourceSpan": [
                587,
                600
              ]
            },
            {
              "text": "Full-year FY2025 revenue: $130.5 billion (up 114% YoY)",
              "sourceSpan": [
                430,
                444
              ]
            },
            {
              "text": "FY2025 data-center revenue: $115.2 billion",
              "sourceSpan": [
                493,
                507
              ]
            },
            {
              "text": "Q4 gaming revenue: $2.5 billion (down 11% YoY)",
              "sourceSpan": [
                1449,
                1461
              ]
            },
            {
              "text": "Q4 automotive revenue: $570 million (up ~100%)",
              "sourceSpan": [
                1627,
                1639
              ]
            },
            {
              "text": "Q4 GAAP diluted EPS: $0.89 (vs $0.49 prior year)",
              "sourceSpan": [
                999,
                1004
              ]
            },
            {
              "text": "Q4 GAAP gross margin: 73.0%",
              "sourceSpan": [
                915,
                920
              ]
            }
          ],
          "totalWords": 355,